{
  "$schema": "https://5thelement.ai/schemas/services.json",
  "version": "2.0",
  "generated": "2026-08-26",
  "supersedes": "1.0",
  "service": "3webobs.com",
  "purpose": "Machine-readable capability and offer layer. Declares capabilities as direction-neutral, and access as policy — not as architecture.",
  "related_resources": [
    "capabilities.json",
    "actions.json",
    "allow-lane-matrix.json",
    "industries.json",
    ".well-known/agent-card.json"
  ],
  "paradigm": {
    "name": "Agent-to-Agents",
    "cardinality": "1:N",
    "statement": "An agent can discover N agents, request N services, combine N results, produce a new service, and become a provider to other agents in turn.",
    "symmetry": "Provider and consumer roles are not fixed. An agent that offers a service today can consume another agent's service tomorrow.",
    "boundary_rule": "The organisational boundary is an access rule, not a limit of the architecture. Separate capabilities are not built for inside and outside.",
    "correct_question": "What capability does it offer, who is allowed to use it, and under what conditions?",
    "incorrect_question": "Is this agent internal or external?",
    "access_lanes": [
      "internal_to_internal",
      "external_to_internal",
      "internal_to_external",
      "external_to_external"
    ],
    "access_lanes_note": "The four lanes describe the context and access policy applied to the same capability. They do not describe four technologies, nor four implementations.",
    "lane_matrix": "https://3webobs.com/allow-lane-matrix.json"
  },
  "access_model": {
    "description": "Each capability separately declares who may discover it, who may request it, what data it may use, which actions are permitted, and what requires human authorisation. The same capability may serve different lanes under different policies.",
    "axes": [
      "discovery — cine o poate vedea declarată",
      "request — cine o poate invoca",
      "interface — the surface through which the request arrives: a human interface or an agent protocol",
      "execution — sub ce identitate se execută",
      "data_scope — ce date îi sunt accesibile în acea bandă",
      "authorisation — ce prag declanșează aprobare umană",
      "commercial_terms — dacă banda respectivă are preț atașat"
    ],
    "commercial_note": "Price does not attach to a capability; it attaches to a lane. The same capability may be free internally and charged externally. This remains a difference of policy, not of paradigm.",
    "interface_note": "Human and agent are not two services. They are two request surfaces over one capability, executing the same code path. Which surface a request arrives through changes the envelope, not the observation."
  },
  "human_oversight": {
    "principle": "The agent proposes and executes within declared limits; the human sets intent, budget, deadline, and the threshold above which human approval is mandatory.",
    "approval_boundary": ".well-known/agent-card.json → human_approval_boundary",
    "signal_reference": "ai28 — Human Approval Boundary Declaration"
  },
  "capabilities": [
    {
      "id": "obs_one_shot",
      "who": "AIVENTURE S.R.L. — 3webobs.com (observation node, AiVenture ADI Network)",
      "what": "Observarea celor trei webs pentru un domeniu — human_web, ai_web, machine_web — cu verdict pe semnal și dovadă per semnal",
      "input": [
        {
          "field": "target_url",
          "type": "string",
          "required": true,
          "description": "URL-ul domeniului de observat"
        },
        {
          "field": "contact_email",
          "type": "string",
          "required": true,
          "description": "Adresa pentru livrarea planului de remediere"
        }
      ],
      "output": {
        "type": "observation_report",
        "format": [
          "application/json",
          "text/html"
        ],
        "contents": "Tabel de semnale cu stare observată, dovadă fetch-uită per semnal, plan de acțiuni de remediere derivat din lipsuri"
      },
      "term": "PT10M",
      "term_human": "maximum 10 minute",
      "action": {
        "name": "request_observation",
        "endpoint": "https://3webobs.com/audit",
        "method": "POST",
        "protocol": "A2A"
      },
      "delivery": "digital — răspuns direct în protocol + email prin magic link",
      "status_tracking": {
        "available": true,
        "endpoint": "https://3webobs.com/a2a",
        "signal_reference": "ai27 — Task Status Contract"
      },
      "operational_status": "operational",
      "access": [
        {
          "lane": "external_to_internal",
          "interface": "human",
          "surface": "https://3webobs.com/ — web form",
          "protocol": "HTTP POST /audit",
          "who_may_request": "any person with a public domain to observe",
          "data_scope": "only the target domain supplied in the request",
          "authorisation": "none_required",
          "response_shape": "rendered report with synthesis and action plan",
          "price": {
            "amount": null,
            "currency": "EUR",
            "status": "NOT_YET_DECLARED"
          },
          "payment": {
            "status": "NOT_YET_DECLARED"
          }
        },
        {
          "lane": "external_to_internal",
          "interface": "agent",
          "surface": "https://3webobs.com/a2a",
          "protocol": "A2A JSON-RPC 2.0, method message/send, skill obs_one_shot",
          "who_may_request": "any authenticated agent acting for an organisation with a public domain",
          "data_scope": "only the target domain supplied in the request",
          "authorisation": "none_required",
          "response_shape": "structured data part: global score, three_webs breakdown, per-signal verdicts with evidence, action plan",
          "discovery": "https://3webobs.com/.well-known/agent-card.json",
          "price": {
            "amount": null,
            "currency": "EUR",
            "status": "NOT_YET_DECLARED"
          },
          "payment": {
            "status": "NOT_YET_DECLARED"
          }
        },
        {
          "lane": "internal_to_internal",
          "interface": "agent",
          "surface": "https://3webobs.com/a2a",
          "protocol": "A2A JSON-RPC 2.0, skill obs_one_shot",
          "who_may_request": "the ADN network's own agents, for self-observation of member domains",
          "data_scope": "member domains declared in network.json",
          "authorisation": "none_required",
          "price": {
            "amount": 0,
            "currency": "EUR",
            "status": "declared"
          }
        }
      ],
      "shared_execution": {
        "statement": "Every lane below resolves to the same execution path: evidence is gathered from the target domain, signals are evaluated against the catalogue, and an action plan is derived. No lane receives a different observation.",
        "determinism": "rule-based; no score is generated by a language model"
      },
      "related_skills": {
        "obs_catalogue": "returns the full signal catalogue — agent lane only",
        "obs_explain": "returns the verdict and evidence for a single signal on a target",
        "obs_diff": "compares a target against a retained baseline observation"
      }
    },
    {
      "id": "obs_permanent",
      "who": "AIVENTURE S.R.L. — 3webobs.com",
      "what": "Observare permanentă a aceluiași domeniu, cu re-evaluare periodică și notificare la schimbarea stării unui semnal",
      "input": [
        {
          "field": "target_url",
          "type": "string",
          "required": true
        },
        {
          "field": "contact_email",
          "type": "string",
          "required": true
        },
        {
          "field": "interval",
          "type": "string",
          "required": false,
          "description": "Cadență de re-observare"
        }
      ],
      "output": {
        "type": "observation_subscription",
        "format": [
          "application/json"
        ],
        "contents": "Re-observare la cadența declarată + notificare la schimbare de stare"
      },
      "term": "recurring",
      "action": {
        "name": "request_permanent_observation",
        "endpoint": "https://3webobs.com/observe",
        "method": "POST",
        "protocol": "A2A"
      },
      "delivery": "digital",
      "status_tracking": {
        "available": true,
        "endpoint": "https://3webobs.com/a2a"
      },
      "operational_status": "declared_not_operational",
      "operational_note": "The subscription is written to KV when the route is called, but no scheduler yet executes the re-observation. Declared as such, not presented as functional.",
      "access": [
        {
          "lane": "external_to_internal",
          "who_may_request": "any authenticated agent",
          "authorisation": "none_required",
          "price": {
            "amount": null,
            "currency": "EUR",
            "status": "NOT_YET_DECLARED"
          },
          "payment": {
            "status": "NOT_YET_DECLARED"
          }
        }
      ]
    }
  ],
  "consumes": {
    "description": "Capabilități pe care acest agent le solicită el însuși altor agenți. Prezența acestei secțiuni este dovada practică a simetriei: același nod este simultan furnizor și consumator.",
    "declared": []
  },
  "capability_template": {
    "description": "The canonical structure a company fills in to declare a capability. Declared once, regardless of how many access lanes consume it. Does not require modifying the existing website.",
    "fields": {
      "who": "The entity accountable for execution",
      "what": "The economic result produced, not the technology",
      "input": "What data must be supplied, with type and requirement",
      "output": "What is produced, in what format",
      "term": "Turnaround, as a declared duration",